productid,productname,manufacturerid,composition,listprice,gender,category,color,description
592,hc 2 ts hightop sneaker,568,Leather Upper and Man-Made Materials,47.99,M,sneakers,Brown,Herringbone pattern sole for traction. Patent leather velcro strap closure. Perforated side panels. Stylish pieced leather construction. Suede toe and heel caps
593,heavy artillery boots,596,"Leather Upper, Textile Insole, Rubber Sole",25.99,M,boots,Black,Metal eyelets. Metal eyelets /li>. Mid top design. Rubber heel. Rubber heel. Self tie lace closure. Suede exterior
594,"helcor 6"" boots",240,"Leather and Textile Upper, Textile Insole and Rubber Sole",140.99,M,boots,Black,400 grams of Thinsulate™ insulation for superior warmth and comfort. Anti-fatigue midsole and footbed provide all-day comfort and support. Durable laces with Taslan® nylon fibers for long-lasting wear. Enhanced waterproof Helcor® leather provides ultimate
595,helcor field boots,240,Leather and man made materials,95.99,M,boots,Black,Helcor genuine leather. Lace up front closure. Ridgid sole detail. Self tie lace closure with metal eyelets. Signature logo on side. Ultra scuff and water proof boot
596,hella cute sneaker,209,Canvas Upper and Rubber Sole,23.99,F,sneakers,"Black,Pink",Canvas upper. Contrast stitch. Cushioned tongue. Durable rubber sole. High top design. Patent bow embellishment on outer. Pieced construction. Self tie lace closure. Signature logo on tongue
597,hi class mid striple strap,568,,43.99,M,sneakers,White,"3-velcro strap closure  /li>. Nontraditional rubber tread for durable traction. Pieced leather upper with suede trim on toe, and perforated accents on panels"
598,hi class mid trstrap sneaker,568,LEATHER UPPER/ RUBBER SOLE,34.99,M,sneakers,Charcoal,"3-velcro strap closure  /li>. Nontraditional rubber tread for durable traction. Pieced leather upper with suede trim on toe, and perforated accents on panels"
599,hi profile hightop sneaker,568,Synthetic Upper and Rubber Sole,43.99,M,sneakers,Black,"Contrasting accent panels. Fila logo on side, tongue and ankle. Logo embossed sole. Logo embossed sole. Padded collar and tongue. Perforations on sides. Perforations on toe and sides. Self tie lace closure. Self tie lace closure. Synthetic construction. V"
600,hi top sneakers,389,Man-made materials,18.99,M,sneakers,Black,Faux leather upper. High top style. Lace up closure. Logo on tongue and heel. Pieced Construction. Rubber sole for traction. US Sizing
602,hightop sneaker,980,All Man Made Materials,24.99,M,sneakers,Black,"Pieced faux suede and leather detail throughout. Plaid tongue, ankle and interior. Rubber sole. Self-tie lace closure. True to size fit"
603,hiker boot,450,Genuine Leather and Man-Made Materials,168,M,boots,Brown,Adjustable ankle strap ensuring joint safety. Flexible footbed for ideal agility while extreme hiking. Nylon and leather upper. Reinforced tab at heel for easy slip-on ability. Shearling faux fur membrane ensuring optimal warmth
604,holly washed canvas sneaker,179,"Textile upper, Rubber outsole",28.99,F,sneakers,Black,Canvas upper. Elastic on tongue for comfortable fit. Lightly padded canvas liner. Reinforced toe. Rubber outsole with logo throughout
605,hops hightop athletic sneaker,573,Leather and man made materials,13.99,M,sneakers,Black,"Brushed synthetic upper. Durable rubber sole. Durable rubber sole. Hi-top design. Hi-top design. Metal logo embellishments on laces, tongue and heel. Pull tab at back. Raised logo on heel. US Sizing"
606,howard black suede sneakers,154,"Suede and Canvas Upper, Rubber sole",36.99,M,sneakers,Black,Durable suede and canvas upper. Form-fitting upper for increased board feel and comfort. Lightweight molded EVA footbed. Low EVA midsole for optimal board control. Performance engineered XLK™ sole construction
607,howard red suede sneakers,154,"Suede and Canvas Upper, Rubber sole",34.99,M,sneakers,Red,Durable suede and canvas upper. Form-fitting upper for increased board feel and comfort. Lightweight molded EVA footbed. Low EVA midsole for optimal board control. Performance engineered XLK™ sole construction
608,hugo low profile sneaker,980,Man-made materials,12.99,M,sneakers,Black,Cushioned insole. Designer logo on tongue. Lace-up closure. Low top design. Metal eyelets. Perforated detail on toe box and outer. Rubber sole. Synthetic leather upper with tone on tone stitch
609,hupper canvas/leather tiger camo sneakers,659,"Leather Upper, Textile Insole, Rubber Sole",59.99,M,sneakers,"Black,Green",Durable drytex interior lining. High Top profile. Leather patch with  debossed logo on tongue. Printed canvas and leather upper. Pull loop on heel. US Sizing. Vulcanized rubber midsole with heel bumper logo
610,hyperculture print chuck taylor all star sneakers,679,"Textile Upper, Textile Insole, Rubber Sole",48.99,F,sneakers,Multi,Canvas upper with multi-color print throughout. Classic logo appliqué on inner ankle. High top design. Low top design. Plated eyelets. Self tie lace closure. Textured toe bumper. Vulcanized rubber sole for traction with double stripe foxing. Vulcanized ru
611,hyperculture print chuck taylor all star two fold sneakers,679,Canvas Upper and Rubber Sole,50.99,F,sneakers,Black,"Canvas upper with multi-color print throughout. Classic logo appliqué on inner ankle. Convertible style with a double upper. Original rubber toe box and toe guard, tonal sidewall trim, medial-side air vent holes and All Star® heel patch. Plated eyelets. S"
612,hyperfuse low sneakers,630,Synthetic upper and rubber sole,79.99,M,sneakers,Navy,Breathable mesh upper. Durable rubber sole. Forefoot Nike Zoom™ unit offers low-profile responsive cushioning in a Phylon™ midsole package to provide a comfortable ride. Hyperfuse upper focuses on an anatomic fit and eyestay to add comfort and breathabili
613,inmate canvas sneakers,293,Canvas upper and Rubber sole,30.99,M,sneakers,Grey,Non-slip herringbone tread pattern on a durable rubber outsole. Rugged canvas uppers with a smooth toe design. Slim fit design with minimal padding for a sleek fit. Thin and lightweight cupsole construction. Thinner sidewalls for improved flexibility and 
614,inmate grey crystal sneakers,293,"Leather Upper, Textile Insole, Rubber Sole",34.99,M,sneakers,Grey,Embroidered logo on tongue and back of heel with logo applique on side. Padded collar for a secure fit and support. Pieced suede construction with tone-on-tone stitching. Translucent rubber cup sole with herringbone pattern for grip
615,iroko rugged boots,692,"Leather Upper, Textile Insole, Rubber Sole",44.99,M,boots,Black,Logo embossed hardware with LRG logo appliques at tongue side. Padded collar for support. Pieced leather upper. Rubber sole with lugs for traction. Self-tie lace closure
617,isa canvas sneakers,550,"Canvas upper, rubber sole",45.99,M,sneakers,Grey,Canvas exterior. Durable rubber outsole. Low top design. Padded ankle lining for extra comfort. Self tie closure
623,jane on wedge,294,Man Made Material,22.99,F,heels,Black,5” Wedge heel. Contrast design. Front strap for support. Pieced constructed. Synthetic   upper
624,janne wedge bootie,691,All man made materials,15.99,F,boots,Tan,"5.50"" wedge heel. Elastic on inner heel. Suede material. Zipper opening on inner side"
636,junette boot,691,Man-Made Materials,18.99,F,boots,Black,1 inch heel. Cushioned insole with arch support. Fur accents. Rubber outsole. Strap detail at top. Synthetic upper. Zipper enclosure
616,irus wedge,691,Man-made materials,24.99,F,wedges,Black,4 inch wedge heel. Braided straw trim. Buckle closure at ankle. Faux suede upper. Lightly padded footbed. Open toe. Rubber sole. US Sizing
618,isa sneakers,550,"Leather Upper, Textile Insole, Rubber Sole",42.99,M,sneakers,Black,"Crooks logo on tongue, heel and outer. Durable rubber out-sole. Leather exterior. Leather upper. Low profile. Low top design. Metal eyelet lace up closure. Padded ankle. Padded ankle lining for extra comfort. Rubber sole. Self tie closure. Tonal stitching"
619,isolation sneakers,514,"Synthetic Upper, Textile and Man Made Materials",55,M,sneakers,Black,All-rubber outsoles for grip and lasting wear. EVA foam insoles provide comfortable support. Molded EVA midsoles are lightweight and cushion your feet. Synthetic uppers with micro-perforated accents
620,jack frost boots,450,"Genuine leather, rubber",150,M,boots,Black,Designer logo on tongue. Flexible footbed for ideal agility while extreme hiking. internal wool lining for maximum warmth. Shearling faux fur membrane ensuring optimal warmth. Thick self-tie lace closure. Tone-on-tone stitching. Top entry pocket for conve
621,jackson midtop sneaker,664,Man made materials,12.99,M,sneakers,Black,Cushioned interior. Cushioned interior. Durable rubber sole. Durable rubber tread. Mecca logo on tongue and heel. Pieced construction. Pieced construction. Self tie closure. Self tie closure
622,jamball v2 hightop sneaker,568,Synthetic Upper and Rubber Sole,49.99,M,sneakers,Black,Contrasting accent panels. Cushioned ankle and tongue. Cushioned ankle and tongue. Fila logo on tongue and outer. Fila logo on tongue and outer. Lace-up closure. Lace-up closure. Logo embossed sole. Logo embossed sole. Pieced synthetic  construction. Roun
625,jayda sandal wedge w/print,691,All Man Made Materials,16.99,F,sandals,Green,5 inch wedged heel. All-over multicolor tribal design. Ankle strap adjustment. Canvas upper. Open toe. Padded footbed. Rubber sole. US sizing
626,jayvee low profile sneaker,970,"Textile Upper, Textile Insole, Rubber Sole",21.99,F,sneakers,Lime Green,Canvas exterior. Designer emblem on heel and outer. Full lace up closure with metal eyelets. Low top design. Padded tongue and collar. Perforated detail. Rubber outsole
627,jean ankle bootie w/ fridge chains,691,Man-made materials,26.99,F,boots,Pink,"2"" elevated front. 6"" spiked heel with fringe detail. Lightly cushioned footbed. Synthetic suede upper. Zipper detail at side"
628,jean ankle bootie w/fridge chains,691,Man-made materials,25.99,F,heels,Black,"2"" elevated front. 6"" spiked heel with fringe detail. Lightly cushioned footbed. Synthetic suede upper. Zipper detail at side"
629,jelly bean leather and beaded sandal,444,Leather and Man-Made materials,43.99,F,sandals,"Brown,Multi",Buckle closure on ankle. Leather sole. Leather upper. Open toe. Straps are accented with beadwork
630,jettison hi sneakers,970,PU Leather and man made materials,45.99,M,sneakers,Black,Coogi applique on outer. Full lace up closure. High abrasion rubber outsole. Leather exterior. Mid top design. Padded ankle interior. Perforated detailing on upper
631,jewel studded sandal,521,Man-Made Materials,21.99,F,sandals,Black,1 inch heel. Adjustable ankle strap. Flat rubber sole. Rounded toe. Synthetic leather upper. Synthetic upper. US Sizing. Vamp embellished with studded jewels
683,knee high elasticized platform boot,911,All man made materials,46.99,F,boots,Black,2 inch platform. 5 inch heel. Interior zipper closure. Over-the-knee design. Pieced construction
690,kornelia mix vegan leather & canvas ankle bootie w/strap,691,Man Made Materials,44.99,F,boots,Brown,"1"" heel. Belted accents on the shaft. Canvas and vegan leather upper. Two tone design"
693,la dodgers limited edition gazelle sneakers,514,Man Made Materials,65,M,sneakers,Blue,"EVA inlay. Self tie closure. Soft, Nubuck upper. Textile lining, and a rubber outsole"
632,jeweled sandal,691,Man-Made Materials,23.99,F,sandals,Black,"Ankle closure with buckle. Faux leather upper. Jeweled embellishments on front strap. Round toe. Rubber sole. Slightly padded footbed. Slightly raised 1"" wedge heel"
633,jillian tall sweater boot,970,Textile Upper,76.99,F,boots,Black,4-button closure. Logo embossed plated hardware on ankle. Rubber sole for traction and durability. Signature multicolor sweater-knit fabric on upper
634,jomei low,781,Man-made materials,14.99,M,sneakers,Black,All-over camouflage print. Canvas upper. Durable rubber sole. Elastic stitch detailing at seams. Elastic stitch detailing at seams. High quality split leather uppers. Internal EVA midsole offers a cushioned ride. Lace-less design with an easy slip on/off 
635,jomei mid,781,Leather and man made materials,18.99,M,sneakers,Brown,Durable rubber sole. Elastic stitch detailing at seams. High quality split leather uppers. Internal EVA midsole offers a cushioned ride. Lace-less design with an easy slip on/off function. Leather and textile upper. Mid top design. US Sizing
637,jungle boots,750,Leather upper and rubber sole,69.99,M,boots,Black,Coated brass eyelet lacing system. Cordura and leather upper. Friction and slip resistant outer sole. Gusseted tongue. Leather and Nylon Upper. Leather collar. Moisture wicking lining. Padded collar. Removable cushion insole. Rust-proof hardwear. Slip res
638,junia studded wedge sneaker,521,Man-Made Materials,24.99,F,sneakers,Black,"Covered wedge 3.5"" heel. Padded collar and tongue with soft textile sock liner. Pieced synthetic leather and textile construction. Printed Apple Bottoms logo on side. Rubber herringbone sole for traction. Self tie lace closure with metal eyelets. Studded "
639,juniper slip - on,692,"Textile Upper, Textile Insole, Rubber Sole",46.99,M,sneakers,Black,Logo tag on reinforced toe. Rubber flocked sole. Slip-on design low top. Textile upper. Threaded lacing throughout ankle
640,juniper slip - on camo,692,Man Made Materials,44.99,M,sneakers,Camo,All-over camouflage print. Logo tag on reinforced toe. Rubber flocked sole. Slip-on design low top. Textile upper. Threaded lacing throughout ankle
641,juno buckle animal trim wedge sneaker,521,Man-made materials,22.99,F,boots,Animal Print,"Allover Apple Bottoms logo print on textile panels. Covered wedge 3.5"" heel. Padded collar and tongue with soft textile sock liner. Pieced synthetic leather and textile construction. Rubber herringbone sole for traction. Self tie lace closure with metal e"
642,juno buckle logo trim wedge sneaker,521,Man-Made Materials,18.99,F,sneakers,Bronze,"Allover Apple Bottoms logo print on textile panels. Covered wedge 3.5"" heel. Padded collar and tongue with soft textile sock liner. Pieced synthetic leather and textile construction. Rubber herringbone sole for traction. Self tie lace closure with metal e"
643,"kadenza glitter, chain, studs, wedge sneaker",521,Man-made materials,59.99,F,sneakers,Black,"Apple Bottoms logo print on tongue and heel. Covered wedge 3.5"" heel. Padded collar and tongue with soft textile sock liner. Pieced synthetic leather and textile construction. Rubber herringbone sole for traction. Self tie lace closure with metal eyelets."
699,lace up short boot,691,Man Made Materials,8.99,F,boots,Black,"1"" heel. Ankle height boots. Fold over flap. Lace up design. Rubber heel for traction. Zipper closure"
706,laser cut sandal,691,Man-Made Materials,22.99,F,sandals,Black,Lightly padded footbed. Open toe. Stylish cut out design. Synthetic leather upper. Zipper at back
708,laveda casual canvas sneaker,521,Canvas Upper and Rubber Sole,23.99,F,sneakers,Blue,Canvas upper. Lace up closure. Low profile. Padded insole. Round toe. Rubber sole. Tone on tone stitch
711,leopard print platform pumps,691,All man made materials,19.99,F,heels,Orange,"5.5"" heel, 1.5"" elevated toe. Leopard print design. Peep toe. Stud embellishments. US Sizing"
644,kalea wedge,691,Man-made materials,25.99,F,wedges,Black,"4.5"" heel with 1"" platform. Buckle closure. Open toe. Oversize floral appliqué with metallic accents. Padded footbed. Rubber sole. Synthetic upper. US sizing"
645,kalo colorblock hightop canvas sneaker,521,"Textile Upper, Textile Insole, Rubber Sole",40,F,sneakers,Black,Comfortable pieced textile upper. Durable rubber sole. Durable vulcanized rubber sole with toe cap and stripe. Embroidered Apple Bottoms logo on side. High top design. Metal  eyelets. Padded collar with contrast color block stripes. Padded mesh ankle supp
646,kamikaze ii mid sneakers,448,"Leather Upper, Textile Insole, Rubber Sole",109.99,M,sneakers,Black,"Breathable mesh lining and a cushioned EVA footbed for comfort and shock absorption. EVA midsole for lightweight cushioning. High-abrasion, non-marking rubber outsole provides long-lasting durability. Padded collar and heel pull loop for easy on and off. "
647,kamikaze ii rain sneakers,448,Man-Made Materials,110,M,sneakers,Grey,"Breathable mesh lining and a cushioned EVA footbed for comfort and shock absorption. EVA midsole for lightweight cushioning. High-abrasion, non-marking rubber outsole provides long-lasting durability. Padded collar and heel pull loop for easy on and off. "
648,kamile gradient colorblocked canvas sneaker,521,"Textile Upper, Textile Insole, Rubber Sole",40,F,sneakers,Blue,Comfortable pieced textile upper. Durable vulcanized rubber sole with toe cap and stripe. Overlapping gradient color blocked panels. Pull tab loop on back of ankle. Rainbow contrast stitching throughout. Self-tie lace closure with flat laces and metal eye
649,kanadia 5 tr trail running sneakers,514,"Synthetic and Textile Upper, Textile Insole, Rubber Sole",70,M,sneakers,Yellow,"Breathable fabric lining. Breathable mesh upper with synthetic overlays. Heel pull loop for an easier on and off. Injected EVA midsole provides long-lasting, lightweight plush. Molded EVA insole supplies light underfoot cushioning. Plush tongue and collar"
650,kanora bootie w/laser cut,691,Man-Made Materials,41.99,F,boots,Black,1 inch heel. Adjustable straps with  buckle detail. Cushioned insole. Rounded toe. Rubber outsole. Synthetic upper with cut out design. Tone on tone stitch
651,kaplan lowtop sneaker,164,Canvas Upper and Rubber Sole,49.99,M,sneakers,Black,Canvas exterior. Cushioned insole. Embossed logo on tongue. Flat rubber sole. Flat sole. Low top style. Perforated leather heel panel. Self tie lace closure. Self tie lace closure. Two metal eyelets for ventilation
652,kaplan mid sneaker,164,Man-Made Materials,44.99,M,sneakers,Red,Canvas upper. Designer logo on heel and tongue. Durable rubber sole. Lace-up closure. Mid top design
653,kaplan natural netting sneaker,164,Canvas and Man Made Materials,38.99,M,sneakers,Off White,Canvas and mesh upper. Cushioned insole. Embossed logo on tongue. Low top style. Self tie lace closure. Vulcanized rubber sole
654,kaplan perf sneaker,164,Leather Upper and Rubber Sole,28.99,M,sneakers,Black,All-over textured detail. Leather upper. Low top design. Rubber Sole. Self tie lace closure. Signature logo on tongue and heel. US sizing
655,kaplan sneaker,164,Man-Made Materials,35.99,M,sneakers,"Black,Red","Canvas exterior. Cushioned insole. Designer logo on tongue, heel and side. Embossed logo on tongue. Flat sole. Low top design. Low top style. Rubber Sole. Self tie lace closure. Self tie lace closure. Textile upper. Two metal eyelets for ventilation. US s"
657,karma fold over faux fur boot,691,Man-Made Materials,8.99,F,boots,Grey,7 eyelet self tie lace closure. Fold-over upper and tongue with faux fur. Pieced construction. Rubber sole for traction
670,kesha woven leather sandal,444,Leather Upper and Rubber Sole,59,F,sandals,Gold,Leather upper. Lightly padded footbed. Open toe. Stylish cut out design with metallic finish. Zipper at back
656,karlee wedge sneaker,521,Synthetic upper and rubber sole,38.99,F,sneakers,Black,"Covered wedge 3.5"" heel. Padded collar and tongue with soft textile sock liner. Pieced synthetic leather and textile construction. Rubber herringbone sole for traction. Strap across vamp. Woven detail throughout"
658,karolina lace up bootie,691,"Synthetic Upper, Textile Insole, Rubber Sole",38.99,F,boots,Black,"2.75"" heel. Allover flower pattern material sockliner. Pieced synthetic leather upper. Self-tie lace closure with metal eyelets and top hooks. Zipper closure on inside of ankle"
659,karolina laceup bootie,691,"Synthetic Upper, Textile, Rubber Sole",38.99,F,boots,Beige,"2.75"" heel. Allover flower pattern material sockliner. Pieced synthetic leather upper. Self-tie lace closure with metal eyelets and top hooks. Zipper closure on inside of ankle"
660,kasmira  sneaker wedge w/studs,691,Man-Made Materials,30.99,F,sneakers,Tan,"3"" inch wedge heel with rubber sole for traction. Crystal embellishments on top of tongue and toe cap. Padded collar for comfortable fit. Pieced synthetic suede construction. Self-tie lace closure with metal eyelets"
661,kasmira sneaker wedge w/studs,691,Man-Made Materials,44.99,F,sneakers,Black,"3"" inch wedge heel with rubber sole for traction. Crystal embellishments on top of tongue and toe cap. Padded collar for comfortable fit. Pieced synthetic suede construction. Self-tie lace closure with metal eyelets"
662,kassey metallic lace sneaker,521,"Synthetic Upper, Textile Insole, Rubber Sole",28.99,F,sneakers,Blue,Classic athletic silhouette. Metal logo-embossed strap and buckle across side of ankle. Metallic embroidered Apple Bottoms logo on side. Self-tie lace closure with flat laces. Textile lace overlay on upper with synthetic metallic patent leather lacestay a
663,keds anchor canvas sneakers,187,"Canvas upper, Rubber sole",19.99,M,sneakers,Red,Canvas exterior. Contrasting stitch. Cushioned insole. Durable rubber sole. Low-top. Retro-inspired foxing stripe. Rounded toe box
664,keds champion laceless animal sneaker,373,"Textile Upper, Rubber Sole",11.99,F,sneakers,Animal Print,Canvas upper. Classic low profile. Lace-less slip on with hidden elastic band and metal eyelets. Padded insole for comfort. Vulcanized rubber sole
665,keds champion laceless fair isle sneaker,373,Canvas Upper and Rubber sole,28.99,F,sneakers,Grey,"Cushioned insole. Flexible, textured rubber outsole. Interior gore for a snug fit. Laceless slip on style. Soft, breathable twill lining. Warm & soft wool upper"
666,keds champion metallic lace sneaker,373,Leather and man made materials,19.99,F,sneakers,Black,"4 eyelet lace up. Cushioned insole. Flexible, textured rubber outsole. Printed metallic leather upper. Soft satin lining. Velvet laces included"
667,keds floral shoe,373,Canvas upper and Rubber sole,25.99,F,sneakers,Blue,"4 eyelet lace up. Classic canvas upper with allover floral design. Flexible, textured rubber outsole. Retro-inspired foxing stripe. Soft breathable lining"
668,keds kimono dot sneaker,373,Canvas Upper and Rubber sole,24.99,F,sneakers,Red,"4 eyelet lace up. Cushioned insole. Flexible, textured rubber outsole. Printed washed canvas upper. Soft breathable chambray lining"
779,mecca low profile sneaker,664,All man made materials,10.99,M,sneakers,White,Flat sole. Low top casual style. Self tie lace closure
786,melaina wedge,691,Man-made materials,23.99,F,wedges,Black,4 inch wedge heel. Faux leather upper. Lightly padded footbed. Open toe. Rubber sole. Slip on style. US Sizing
789,metal beads sandal,521,Man-Made Materials,40,F,sandals,Black,1 inch heel. Adjustable ankle strap. Flat rubber sole. Metal bead embellishments. Rounded toe. Synthetic upper. US Sizing
791,mia rainboot,691,Man-made materials,35.99,F,boots,Black,Below the knee length. Insulated with fleece lining. Rubber sole. Synthetic upper with contrast piping
669,kenelly mesh inspired bootie,691,Man Made Materials,40.99,F,boots,Beige,2.5 inch heel. Cushioned insole. Pull on style. Rounded toe. Rubber outsole. Synthetic leather upper with perforated shaft. Tone on tone stitch
671,ketch ruffle bootie,691,All man made materials,15.99,F,boots,Brown,1 inch hidden platform. 4.5 inch stiletto stacked heel. Faux fur lining. Smooth lining and soft insole. Synthetic upper with ruffle design. Zipper closure
673,kila wild snake pattern sneaker,521,Man-Made Materials,13.99,F,sneakers,Black,Classic basketball high top profile. Embroidered lurex Apple Bottoms logo on side of heel. Logo embossed strap across side of shaft. Self-tie lace closure with metal eyelets. Textile upper with large snake pattern. Vulcanized rubber sole with striped smoo
674,king low,781,Leather and man made materials,17.99,M,sneakers,Cream,Durable rubber sole. Elastic stitch detailing at seams. Internal EVA midsole offers a cushioned ride. Lace-less design with an easy slip on/off function. Leather upper is breathable and durable. US Sizing
675,king supa hi,781,Leather and Man Made Materials,23.99,M,sneakers,Light Grey,Leather and textile upper with plaid design on outer. Perforated detail on outer. Rubber outsole. Super High top design  with double velcro straps. Textured toe bumper. Thick elastic band across vamp. Tone on tone stitch
679,kiss the sky sneaker wedge w/studs,691,Man Made Materials,38.99,F,wedges,Black,Lace up closure. Padded ankle. Rubber sole. Studded appliques on tongue and velcro strap. Synthetic layered meshed upper. US sizing
680,kita glitter sneaker,521,Man-made materials,24.99,F,sneakers,"Black,Black",Classic basketball high top profile. Embroidered lurex Apple Bottoms logo on side of heel. Logo embossed strap across side of shaft. Self-tie lace closure with metal eyelets. Textile upper with all-over black glitter pattern. Textile upper with all-over g
681,kivo aztec side canvas sneaker,521,"Top: 100% Cotton Bottom: 80% Cotton, 20% Polyester",40,F,sneakers,Black,Aztec-like stripe pattern on front half of vamp. Comfortable pieced textile upper. Durable vulcanized rubber sole with stripe. Embroidered Apple Bottoms logo on outside of ankle. Self-tie lace closure with flat laces and metal eyelets
682,knee high buckle trim boot,911,All man made materials,56.99,F,boots,Brown,1 inch heel. Knee high boots. Padded footbed. Synthetic upper with buckle accents at shaft. Textured footbed. Zipper closure
684,knight lo,781,Leather and Man Made Materials,19.99,M,sneakers,Green,Durable rubber sole. Internal EVA midsole offers a cushioned ride. Lace-less design with wide elastic closure. Leather and canvas upper. US Sizing
