productid,productname,manufacturerid,composition,listprice,gender,category,color,description
285,champion oxford cvo canvas,373,Canvas Upper and Rubber Sole,24.99,F,sneakers,Cream,"4 eyelet lace up. Classic canvas upper. Constrast stitching. Constrasting stitch. Flexible, textured rubber outsole. Soft breathable lining"
287,chaveta sneakers,276,Synthetic Upper and Rubber Sole,36.99,M,sneakers,Grey,"Durable, abrasion-resistant rubber outsole. EVA midsole features a traditional vulcanized wrap for maximum support and comfort. Lace-up closure. Padded tongue and collar for additional comfort and support. Suede upper with plaid side panel hits and interi"
289,chehalis,781,Leather and Man Made Materials,16.99,F,sneakers,Black,Cushioned footbed. Durable rubber outsole. Embroidered logo on tongue and outer. Self tie lace closure. Smooth leather upper with sueded side inlays. US Sizing
293,chuck taylor all star core sneakers,679,"Textile Upper, Textile Insole, Rubber Sole",55,U,sneakers,Black,"Canvas lined with lightly padded footbed for comfort. Canvas material. Canvas upper. Classic low top design. Classic old school design. Classic rubber outsole. Flat, rubber sole. Hi-top sneakers with canvas uppers. Pieced material on side with logo. Retro"
297,chuck taylor all star extreme color sneakers,679,"Textile Upper, Textile Insole, Rubber Sole",44.99,M,sneakers,Blue,"Classic diamond-patterned rubber outsole. Rubber midsole. Signature Chuck Taylor rubber toe box and rubber toe bumper, contrast sidewall piping, dual air-vent portholes on medial side and All Star heel patch. Textile lining and a cushioned footbed. Tradit"
298,chuck taylor all star extreme hype sneakers,679,"Textile Upper, Textile Lining, Rubber Sole",60,M,sneakers,Black,Canvas exterior. Designer applique logo on inner side. High top design. Lace closure. Padded tongue and ankle. Plated eyelets. Rubber shell toe
300,chuck taylor all star hi ness sneakers,679,Canvas Upper and Rubber Sole,53.99,F,sneakers,Black,"Canvas uppers. Classic Converse diamond-print rubber outsole. Slightly raised heel with classic Chuck Taylor All Star touches like a rubber toe box, textured toe bumper, medial-side airvent portholes and All Star heel patch details. Traditional lace up fr"
301,chuck taylor all star kriss n kross sneakers,679,Man Made Materials,39.99,F,sneakers,White,Dual color laces. Grommeted ventilation. Lace up closure. Low top design. Rubber outsole
302,chuck taylor all star leather sneakers,679,"Upper: Leather, Lining/Outsole: Man-made material",61.99,U,sneakers,Black,"Classic leather upper. Classic low top design. Embossed classic ""All Star"" logo. Full lace up closure. Iconic high top design. Lace-up closure. Leather Converse Chuck Taylor patch on inside of ankle. Nontraditional rubber sole provides traction. Pieced sm"
304,chuck taylor all star lp sneakers,679,"Canvas Upper, Rubber Sole",55,U,sneakers,White,Canvas upper. Classic low top design. Classic rubber outsole. Vulcanized construction
306,chuck taylor all star slip on sneakers,679,Canvas Upper and Rubber sole,43.99,M,sneakers,Blue,Built-in elastic support strap underneath the tongue to give you a nice snug fit without the constrictions of laces. Canvas lining with a cushioned footbed. Classic Canvas upper. Low top design. Signature Converse® rubber outsole
307,chuck taylor all star slip sneakers,679,"Textile Upper, Textile Insole, Rubber Sole",48.99,M,sneakers,Black,Built-in elastic support strap underneath the tongue to give you a nice snug fit without the constrictions of laces. Canvas exterior. Canvas lining with a cushioned footbed. Classic Canvas upper. Classic low top design. Low top design. Padded footbed. Rub
308,chuck taylor all star sneakers,679,"Textile Upper, Textile Insole, Rubber Sole",60,U,sneakers,Camo,Canvas lined with lightly padded foot bed for comfort. Canvas upper with multi-color heart print throughout. Classic canvas construction. Classic diamond-patterned rubber outsole. Classic high top design. Classic logo appliqué on tongue and inner ankle. E
311,chuck taylor all star specialty sneakers,679,"Textile Upper, Textile Insole, Rubber Sole",55,U,sneakers,Charcoal,Canvas exterior. Classic low top design. Rubber sole with smooth shell toe
312,chuck taylor all star xx hi sneakers,679,Canvas Upper and Rubber Sole,55.99,F,sneakers,Navy,"Canvas lining with lightly cushioned footbed for added comfort. Canvas upper. Classic Chuck Taylor® All Star® rubber toe box, rubber toe guard, tonal sidewall trim and All Star® heel patch. Fixed laces with full-length zipper closure at rear. Signature Co"
314,chuck taylor hi sneakers,679,Canvas Upper and Rubber Sole,55,M,sneakers,Red,Canvas lined with lightly padded foot bed for comfort. Classic canvas construction with contrasting stitch. Hi-top design. Lace-up front with metallic eyelets. Vintage Converse rubber toe cap. Vulcanized construction with rubber outsole provides traction 
323,circa hesh sneakers,980,Leather Upper and Rubber Sole,35.99,M,sneakers,Black,Durable rubber sole. Lace-up closure. Logo on tongue and outer. Rounded toe-box. Suede upper. Tone on tone stitch
338,clear sandal,691,Man-Made Materials,17.99,F,sandals,Black,Adjustable side-buckle closure. Jelly-like upper. Lightly cushioned footbed. Rubber outsole. Thong style
340,cloak boat shoes,389,Man-made materials,25.99,M,casual shoes,Brown,Boat shoe inspired design. Contrasting stitch trim. Durable rubber sole. Lace closure. Synthetic construction
315,chuck taylor hi star sneakers,679,Canvas Upper and Rubber Sole,60,M,sneakers,Red,Canvas lined with lightly padded foot bed for comfort. Classic canvas construction with all-over contrasting star design. Hi-top design. Lace-up front with metallic eyelets. Vintage Converse rubber toe cap. Vulcanized construction with rubber outsole prov
316,chuck taylor ox black denim sneakers,679,"Textile Upper, Textile Insole, Rubber Sole",55,M,sneakers,Black,Canvas lined with lightly padded foot bed for comfort. Classic denim construction with contrasting stitch. Lace-up front with metallic eyelets. Low-top design. Vintage Converse rubber toe cap. Vulcanized construction with rubber outsole provides traction 
317,chuck taylor ox blue sneakers,679,Canvas Upper and Rubber Sole,50,M,sneakers,Blue,Canvas lined with lightly padded foot bed for comfort. Classic canvas construction with contrasting stitch. Lace-up front with metallic eyelets. Low-top design. Vintage Converse rubber toe cap. Vulcanized construction with rubber outsole provides traction
318,chuck taylor ox sneakers,679,Canvas Upper and Rubber Sole,55,M,sneakers,"Lime Green,Yellow",Canvas lined with lightly padded foot bed for comfort. Canvas upper. Classic canvas construction with contrasting stitch. Classic low top design. Classic rubber outsole. Lace-up front with metallic eyelets. Low-top design. Vintage Converse rubber toe cap.
319,chukka hightop sneaker,512,Man-made materials,19.99,M,sneakers,"Black,Blue",Designer logo on tongue and outer. High top design. Mesh tongue. Padded ankle support. Pieced constructed. Rubber sole. Self tie lace closure
320,cinque 2 mid lx sneakers,481,"Textile Upper, Textile Insole, Rubber Sole",56.99,M,sneakers,Silver,Classic lace up enclosure. Durable rubber outsole. Gourmet logo on heel and outer. Mid Top Design. Woven Textile fabric upper with leather accents
321,cinque 2 mp pyramid studded calf leather sneakers,481,Leather Upper and Rubber Sole,89.99,M,sneakers,Tan,Durable rubber outsole. Gourmet logo on heel. Italian pyramid studded calf leather upper. Low Top Design. Waxed cotton laces
322,circa 50 classic sneakers,980,Canvas Upper and Rubber Sole,36.99,M,sneakers,Navy,Durable rubber sole. Lace-up closure with metal eyelets. Logo on tongue and outer. Pieced canvas construction. Rounded toe-box. Tone on tone stitch
324,circa lopez 13 sneakers,980,Textile Upper and Rubber Sole,34.99,M,sneakers,Black,"Canvas upper. Durable rubber sole. Logo on tongue, heel and outer. Low top design. Self-tie lace closure. Tone on tone stitch"
325,circan drifter sneakers,980,Canvas Upper and Rubber Sole,38.99,M,sneakers,Charcoal,Durable rubber sole. Lace-up closure with metal eyelets. Logo on tongue and outer. Pieced canvas construction. Rounded toe-box. Tone on tone stitch
326,city girl ruffle & bow detail pump,691,Man-made materials,19.99,F,heels,Black,1 inch platform. 5 inch sturdy stiletto heel. Lightly cushioned insole. Pointed toe. Ruffle and bow detail. Synthetic exterior. Synthetic sole
327,city roc hi sneakers,695,"Leather and Textile Upper, Textile Insole, Rubber Sole",64,M,sneakers,Black,Durable rubber sole. Embossed Rocawear logo on side of tongue and heel. Lace enclosure. Leather and mesh upper. Lightly padded collar and tongue for a comfortable fit. Nubuck and mesh upper with tone-on-tone stitching throughout. Perforated detail. Pieced
328,city runner basic pump w/heel detail,691,Man-made materials,16.99,F,heels,Black,2 inch platform. 5 inch sturdy stiletto heel. Lightly cushioned insole. Pointed toe. Satin bow detail. Synthetic sole. Synthetic suede exterior
329,cl exertion mid sneakers,448,Leather Upper and Rubber Sole,69.99,M,sneakers,White,Abrasive rubber outsole for extra durability and traction. Embossed logo on tongue and outer. Lace up closure with metal Reebok emblem. Lightweight EVA at midsole. Padded foam sock liner. Perforated design at toe front. Soft leather upper
330,cl nylon slim sneakers,448,"Leather and Synthetic Upper, Textile Insole, Rubber Sole",36.99,F,sneakers,Grey,Cushioned sole for comfort. Includes extra set of laces. Low profile. Rip-stop nylon in aubergine and citron balance the muted suede overlays and leather accents to create a fresh look. Rubber outsole for durability. Self tie lace closure. Signature Reebo
331,classic driving moccasin,512,Man-Made Materials,50,M,casual shoes,Black,Cushioned insole for comfort. Metal buckle vamp detail. Rubber sole for traction. Signature logo tag on outer. Slip-on design. Synthetic leather upper with contrast stitching throughout
332,classic jam sneakers,448,"Leather Upper, Textile Insole, Rubber Sole",85,M,sneakers,Grey,Classic high top profile. Leather upper. Padded collar. Padded collar and tongue with logo. Pieced material design with perforated detail. Rubber sole for traction. Self tie lace closure. Signature Reebok logo on tongue and outer heel
333,classic jam snekaers,448,Leather and Man Made Materials,84.99,M,sneakers,Black,Classic high top profile. Leather upper. Padded collar. Pieced material design with perforated detail. Rubber sole for traction. Self tie lace closure. Signature Reebok logo on tongue and outer heel
334,classic leather ice sneakers,448,"Leather Upper, Textile Insole, Rubber Sole",80,M,sneakers,White,Abrasive rubber outsole for extra durability and traction. Embossed logo at heel and outer. Leather upper. Lightweight EVA at midsole. Logo patch at side quarter panel and tongue. Padded foam sock liner. Perforated design at toe front
335,classic leather vintage sneakers,448,"Leather Upper, Textile Insole, Rubber Sole",95,M,sneakers,Blue,Abrasive rubber outsole for extra durability and traction. Embossed logo at heel and outer. Lightweight EVA at midsole. Logo patch at side quarter panel and tongue. Padded foam sock liner. Perforated design at toe front. Soft garment leather upper
336,classic moccasin,512,Man-Made Materials,38.99,M,casual shoes,Black,Cushioned insole for comfort. Rubber sole for traction. Signature logo tag on outer. Slip-on design. Synthetic leather upper with contrast stitching throughout
337,classic pelle boot,966,Leather and Man-Made Materials,43.99,M,boots,Black,"Genuine leather lining. Leather upper. Metal embossed logo bar across laces. Metal logo appliques on back of ankle and lace holder. Padded synthetic suede collar for secure, comfortable fit. Pieced synthetic leather upper. Rubber sole for traction. Rugged"
339,clima ride tr m sneakers,514,"Synthetic and Mesh,  Man Made Materials",45.99,M,sneakers,Black,"Plush, contoured heel cup for added comfort and performance. Signature logo on side and Tongue. Synthetic overlays allow for heightened flexibility while suppling structural support. Tongue and heel pulls for easier on/off"
341,club c sneakers,448,Leather and man made materials,43.99,M,sneakers,Red,Abrasive rubber outsole for extra durability and traction. Embossed logo at heel and outer. Lightweight EVA at midsole. Logo patch at side quarter panel and tongue. Padded foam sock liner. Perforated design at toe front. Soft garment leather upper
342,clutch hidden wedge sneaker,209,"Textile Upper, Textile Insole, Rubber Sole",43.99,F,sneakers,"Black,Multi","2"" hidden wedged heel. 80's era neon color blocking and black faux suede upper. Contrast stitch. Covered wedge 2"" heel. Embroidered logo on tongue. Lace up style. Metallic embroidered logo on tongue. Neon color blocking and black faux suede upper. Padded "
343,combat boots,750,"Leather Upper, Rubber Sole",69.99,M,boots,Black,Good year welt. Oil resistant outer sole. Padded cushion insole. Steel shank. Top grain cowhide leather
344,comfort strap stud trim wedge sandal,911,Man-Made Materials,50.99,F,sandals,Blue,"2"" heel. Buckle closure with elastic insert. Canvas and synthetic upper with neon accents. Comfortable, lightly padded footbed. Rubber outsole. Studded trim detail"
345,commander td 3 sneakers,514,"Leather and Synthetic Upper, Textile Insole, Rubber Sole",70,M,sneakers,Black,adiPRENE®+ insert in the forefoot for efficient movement. Comfortable textile lining. Cushioned EVA insole and soft textile lining for a comfortable feel. EVA midsole for a comfortable fit. Feathered construction for use in multiple sports. Lightweight an
346,coogi sweater short boot,970,"Textile Upper, Textile Insole, Rubber Sole",50.99,F,boots,Black,arm synthetic sherling lining. Authentic sweater weave. Button detail closure. Rubber sole with embossed Coogi logo. Shaft is 7 inches tall. Sweater patterns may vary. Synthetic suede heel cap with embroidered Coogi logo
347,coogified hightop sneaker,970,Leather Upper and Rubber Sole,55.99,M,sneakers,"Black,Yellow",Embossed Coogi logo on tongue and outer. Full lace up closure. High abrasion rubber outsole. Leather exterior with patent leather accents. Mid top design. Padded tongue. Perforated lining. Velcro strap across top with affixed metal embossed COOGI logo
348,cork screw wedge,691,Man-made materials,15.99,F,wedges,Beige,4 inch cork wedge heel. Adjustable ankle strap. Faux leather upper. Flower appliqué on front. Lightly padded footbed. Peep toe design. Rubber outsole for grip
349,cortez basic nylon sneakers,630,Leather and man made materials,54.99,M,sneakers,Black,Designer logo on tongue and heel. Leather and nylon upper. Padded ankle lining. Pieced construction. Self tie lace closure. Signature swoosh on side panels
350,cosmic mid cool sneaker,927,"Textile Upper, Textile Insole, Rubber Sole",52.99,F,sneakers,Black,Adjustable bungee feature at the heel for custom fit. Combination upper with faux patent overlays and textured accents. Contrasting color midsole. Cushioned footbed. Lace-up front for a comfort fit. Midrise design provides ankle support. Padded tongue and
351,cota hightop sneaker,164,"Leather Upper, Textile Insole, Rubber Sole",90,M,sneakers,Black,High top design. Leather upper. Padded collar with perforated side panels for comfortable and secure fit. Padded tongue with rubber logo applique on front. Padded tongue with rubber logo appliqué on front. Perforated ankle panels. Pieced smooth grain leat
359,craver midtop sneaker,970,LEATHER UPPER/ TPR SOLE ,29.99,F,sneakers,Black,Full lace up closure. Leather exterior. Mid top design. Wide velcro strap across tongue
372,daisy stud heel,691,Man-made materials,23.99,F,heels,Black,2 inch platform. 5.5 inch studded heel. Lightly padded footbed. Synthetic upper with all-over rhinestone stud detail. US Sizing
382,deck boat shoes,389,Man-made materials,25.99,M,casual shoes,Black,Contrast stitching. Faux leather upper. Low top boat shoe design. Rubber outsole. Self tie lace closure
352,court attitude sneakers,514,"Leather Upper, Textile Insole, Rubber Sole",85,M,sneakers,Black,Comfortable EVA molded insole with mesh socklining provides a comfortable and supportive ride. Contrasting stripes and Trefoil logo. Durable rubber sole with ridged tread. Pieced and padded collar with reinforced heel panels. Self-tie lace closure with me
353,court blaze lqc sneakers,514,Leather and man made materials,59.99,M,sneakers,Grey,High top style. Rubber sole for traction. Self tie lace closure. Signature 3 stripes on sides. Signature logo on tongue
354,court deck sneakers,514,Canvas Upper and Rubber Sole,65,M,sneakers,Silver,Boat shoe style. Canvas upper. Low top sneaker. Padded sole for ultimate comfort. Padded tongue with logo. Vulcanized sole. Waxed cotton laces
355,court tour leather sneakers,630,Leather and man made materials,40.99,M,sneakers,Maroon,Contrasting signature swoosh on the sides. Flat rubber sole. Leather upper. Lightly padded ankle lining. Low top design. Mesh inside lining for breathability. Perforated detail on outer. Self tie lace closure
356,court victory pump grizzly sneakers,448,Leather and Man-Made materials,134.99,M,sneakers,Brown,Combines cushioning and light weight for superb performance. Durable rubber sole. Felt and Nylon upper. Hexalite honeycomb design. Hi top design. High top design. Lace up closure. Mesh lining for breath-ability. Padded Ankle. Padded tongue with Reebok log
357,court vulc se sneakers,384,"Leather Upper, Textile Insole, Rubber Sole",60,M,sneakers,"Grey,Light Grey",Classic self-tie lace closure. Contrasting designer insignia on side panel. Durable vulcanized rubber sole for optimal traction and board feel with contrasting foxing & stripe. Smooth nubuck upper for optimal grip and durability
358,court vulc sneakers,384,"Leather Upper, Textile Insole, Rubber Sole",55,M,sneakers,Black,Classic self-tie lace closure. Contrasting designer insignia on side panel. Durable vulcanized rubber sole for optimal traction and board feel with contrasting foxing & stripe. Smooth nubuck upper for optimal grip and durability
360,crazy fast sneakers,514,"Synthetic upper, textile and man made materials",120,M,sneakers,Black,Classic 3 Stripes logo at rear and Trefoil logo on tongue. Dual-density EVA forefoot midsole. Padded collar and tongue. Seamlessly bonded SPRINTWEB upper construction. Synthetic leather upper. Textile lining and a cushioned EVA insole. TORSION® SYSTEM for
361,crazy light sneakers,514,Synthetic Upper and Rubber Sole,110.99,M,sneakers,Black,Internal EVA midsole for cushioning; Comfortable textile lining; miCoach compatible. Multilevel pattern of high-traction rubber compound increases surface area and limits dust buildup. SPRINTFRAME adds stability and speed through geometry to create a ligh
362,crazy quiks sneakers,514,Synthetic Upper and Rubber Sole,65.99,M,sneakers,Black,"Cushioning removable insole accommodates orthotics. Molded EVA insole midsole provides lightweight, flexible support and comfort. Patented adiPRENE+ forefoot cushioning provides lightweight but effective shock absorption. Pieced construction. Self tie lac"
363,crazy shadow 2 sneakers,514,"Synthetic and Textile Upper, Textile Insole, Rubber Sole",57.99,M,sneakers,Blue,miCoach compatible. NON MARKING rubber outsole for ultimate grip. Synthetic leather and mesh upper. TORSION® provides adaptive midfoot support. Welded SPRINTWEB for lightweight support and breathability
364,crest lace up sneaker,966,Synthetic and Suede Upper and Rubber Sole,70,M,sneakers,Black,Designer crest logo patch on outer. Durable sole designed for traction. Embossed logo on tongue and heel. Lace up closure with metal eyelets. Low Top design. Padded heel and ankle. Pieced leather and suede upper. US Sizing
365,crofton house,781,"Leather Upper, Textile Insole, Rubber Sole",14.99,F,sneakers,Ivory,Durable lightweight rubber bottom for comfort and traction. Features a combination zipper/elastic closure for an adjustable yet elastic fit. Intricate embroidered logo on heel. Leather upper. Micro low rise wedge for stylish height. Slightly raised super 
366,cross em sneakers,514,"Synthetic Upper, Textile Insole, Rubber Sole",65,M,sneakers,"Black,Blue,Yellow","Air mesh window panels on the heel with a perforated toe box promote ideal air circulation. Breathable mesh lining and an EVA insole. Central lacing closure for a secure, lockdown fit. Comfortable padded collar and tongue with EVA molded insole with soft "
367,cunningham rust canvas/nubuck sneakers,684,"Canvas, Leather and Man Made Materials",95,M,sneakers,Crimson,Canvas and Nubuck upper. Classic self-tie lace closure with boot style laces. Designer logos on tongue and side panel. Durable rubber sole for optimal traction. Extra padded ankle for superior protection. Mid-top design. US sizing
368,cuttler low sneakers,684,"Leather Upper, Textile lining and Rubber Sole",50.99,M,sneakers,White,Flexible collar. Lace-up closure and flexible tongue. Leather upper. Lugged rubber outsole. Signature logo on tongue and heel. Textile lining
369,daiso,691,Man-Made Materials,11.99,F,flats,Black,3.5 inch heel. Classic slip on construction. Durable rubber sole for optimal traction. Signature leather straps across foot-bed. Zipper closure in heel
370,daisy faux snake skin print heel,691,All man made materials,32.99,F,heels,Black,2 inch platform. 5.5 inch heel. All-over faux snakeskin  print with synthetic suede detail. Lightly padded footbed. Round toe. US Sizing
371,daisy stud detail pump,691,All man made materials,31.99,F,heels,Black,2 inch platform. 5.5 inch metallic heel. Lightly padded footbed. Peep toe design. Synthetic upper with stud and rhinetone detail throughout. US Sizing
373,damia stripe canvas sneaker,521,Man-Made Materials,28.99,F,flats,"Black,White",Canvas upper with all-over stripe print. Low profile. Padded insole. Round toe. Rubber sole. Slip on design with elastic for secure fit
374,dance urlead mid sneakers,448,Man-Made Materials,84.99,F,sneakers,Black,"3D FuseFrame offers structure, support and a seamless design. Athletic mid top profile. EVA sockliner for cushioning. Non-marking rubber outsole. Pivot point, turn zone and asymmetrical center line flex grooves optimized for dance movements. Synthetic mes"
375,dandy shoes,389,Man-made materials,32.99,M,casual shoes,Black,Classic lace up design. Contrasting stitch. Cushioned insole. Perforated detail throughout. Rubber sole for traction. Synthetic leather upper
376,danick wedge sneaker,691,Man-Made Materials,46.99,F,sneakers,Black,"All-over stud detail. Covered wedge 3.5"" heel. Padded collar and tongue with soft textile sock liner. Pieced synthetic leather construction. Rubber herringbone sole for traction. Triple buckle straps at vamp"
387,defeo chambray sneakers,164,Leather and Man Made Materials,54.99,M,sneakers,Grey,Leather upper. Metal logo plate on side. Pieced constructed. rubber sole. Self tie enclosure
391,demure low wedge sandal,691,Man-Made Materials,37.99,F,sandals,Black,"1 1/2"" wedged heel. Back zip closure. Flocked rubber sole. Hardware embellished vamp. Synthetic leather upper. Thong toe"
395,destiny crystal chain sandal,691,Man-Made Materials,68,F,sandals,Black,1 inch heel. Flat rubber sole. Rounded toe. Synthetic leather upper. US Sizing. Vamp embellished with studded jewels
377,dart 9 sneakers,630,"Synthetic and Textile Upper, Textile Insole, Rubber Sole",58,M,sneakers,Black,Breathable mesh upper. Flex grooves along the outsole allow the foot to move more fluidly throughout the gait cycle. Flex grooves along the outsole allow the foot to move more fluidly throughout the gait cycle. Lightly padded tongue and collar for added c
378,dazzle  bootie w/stone detail,691,Man-made materials,30.99,F,heels,Black,"2"" elevated front with spiked detail. 5.5 inch heel. Pointed toe. Rubber sole for traction. Spiked embellishments throughout heel. Synthetic suede upper. Zipper detail at side"
379,de ville ankle bootie w/faux fur,691,Man-made materials,13.99,F,boots,Grey,1 inch hidden platform. 4.5 inch heel. Faux fur lining. Smooth lining and soft insole. Stiletto stacked heel. Stunning pointy toe. Zipper and self tie closure
380,dean leather and canvas boots,823,"Leather Upper, Textile Insole, Rubber Sole",80,M,boots,Black,Coated canvas shell. Combination upper of leather and canvas. Cushioned footbed. Herringbone rubber outsole. Lightly padded tongue and collar. Signature logo on tongue and outer. Soft canvas lining
381,dean shoes,389,Man-made materials,14.99,M,casual shoes,Brown,1 inch heel. Classic lace up design. Contrasting trim. Cushioned insole. Rubber sole for traction. Stitch design on top. Synthetic leather upper
383,deckhand chukka,781,Canvas and Man Made Materials,24.99,M,sneakers,Blue,Canvas upper. Designer label on tongue and outer. Durable rubber sole. Mid top design. Slip on style. Stretch bungee cord for snug feeling. Tone on tone stitch
385,defeo blue chambray navy sneaker,164,"Leather, Textile and Man Made materials",38.99,M,sneakers,"Medium Wash,Navy",Contrast stitch. Hidden self tie lace detail. Leather and textile style material exterior. Printed designer logo with pieced emblem on side. Wingtip shoe design
386,defeo camo sneaker,164,"Leather and Textile Upper, Textile Insole, Rubber Sole",36.99,M,sneakers,Camo,Allover camouflage pattern upper. Concealed self-tie lace closure with flat laces. Durable rubber cupsole with herringbone pattern tread for traction. Leather wingtip toebox and heel panels. Printed logo on tongue with metal hardware piece on side. Stylis
388,defeo lowtop sneaker,164,"Leather and Textile Upper, Rubber Outsole",35.99,M,sneakers,"Green,White",Hidden self tie lace detail. Leather and textile style material exterior. Printed designer logo with pieced emblem on side. Wingtip shoe design
